[
  {
    "id": "seg_briefing-001",
    "source_id": "src_briefing",
    "title": "Core themes",
    "segment_type": "section",
    "segment_ref": "segment-001",
    "body": "- Narrative clarity\n- Constraint as a design tool\n- Process visibility",
    "topics": [
      "design-indaba-2025"
    ],
    "status": "unreviewed"
  },
  {
    "id": "seg_briefing-002",
    "source_id": "src_briefing",
    "title": "Repeated ideas",
    "segment_type": "section",
    "segment_ref": "segment-002",
    "body": "- Show the reasoning, not only the result\n- Structure improves creative confidence",
    "topics": [
      "design-indaba-2025"
    ],
    "status": "unreviewed"
  },
  {
    "id": "seg_briefing-003",
    "source_id": "src_briefing",
    "title": "Open questions",
    "segment_type": "section",
    "segment_ref": "segment-003",
    "body": "- Which practices generalise across disciplines?\n- Which techniques depend on presenter context?",
    "topics": [
      "design-indaba-2025"
    ],
    "status": "unreviewed"
  }
]
